{
  "model_facts_version": "0.1.0",
  "name": "Claude Sonnet 4",
  "developer": "Anthropic",
  "status": "active",
  "license": "Proprietary (API)",
  "release_date": "2025-05-22",
  "homepage": "https://www.anthropic.com/news/claude-4",
  "architecture": {
    "type": "undisclosed (transformer-family)",
    "parameters": "undisclosed",
    "context_window": "200k",
    "quantization": "undisclosed",
    "modalities_in": [
      "text",
      "image"
    ],
    "modalities_out": [
      "text"
    ]
  },
  "training": {
    "knowledge_cutoff": "undisclosed",
    "methodology": "undisclosed (Constitutional AI / RLHF lineage)",
    "tokens": "undisclosed"
  },
  "capabilities": {
    "natural_language": "full",
    "reasoning_math": "high",
    "coding": "high",
    "vision_input": "enabled",
    "audio_input": "disabled",
    "tool_use": "native",
    "notes": "Balanced Claude 4 tier for coding and agents"
  },
  "safety": {
    "refusal_sensitivity": "high",
    "instruction_following": "high",
    "filter_type": "censored"
  },
  "generated": {
    "date": "2026-08-03",
    "generator": "directory seed — human-reviewed judgment fields"
  },
  "credits": {
    "generated_with": "https://modelfacts.dev",
    "built_by": "Catalyst Forge — https://www.catalystforge.com/"
  }
}
