{
  "model_facts_version": "0.1.0",
  "name": "nemotron-3-nano",
  "developer": "nvidia",
  "status": "active",
  "license": "UNKNOWN",
  "homepage": "https://ollama.com/library/nemotron-3-nano",
  "weights": "https://ollama.com/library/nemotron-3-nano",
  "architecture": {
    "type": "undisclosed",
    "parameters": "30B",
    "context_window": "undisclosed",
    "quantization": "GGUF (Ollama default)",
    "modalities_in": [
      "text"
    ],
    "modalities_out": [
      "text"
    ]
  },
  "training": {
    "knowledge_cutoff": "undisclosed",
    "methodology": "undisclosed (draft from Ollama library listing)",
    "tokens": "undisclosed"
  },
  "capabilities": {
    "natural_language": "full",
    "reasoning_math": "medium",
    "coding": "medium",
    "vision_input": "disabled",
    "audio_input": "disabled",
    "tool_use": "native",
    "notes": "Draft. Nemotron-3-Nano is a new Standard for Efficient, Open, and Intelligent Agentic Models, now updated with a 4B parameter count model."
  },
  "safety": {
    "refusal_sensitivity": "medium",
    "instruction_following": "medium",
    "filter_type": "hybrid"
  },
  "generated": {
    "date": "2026-09-01",
    "generator": "directory refresh — Ollama listing draft"
  },
  "credits": {
    "generated_with": "https://modelfacts.dev",
    "built_by": "Catalyst Forge — https://www.catalystforge.com/"
  }
}
