{
  "model_facts_version": "0.1.0",
  "name": "Kimi-K3-DSpark",
  "developer": "RadixArk",
  "status": "active",
  "license": "UNKNOWN",
  "homepage": "https://huggingface.co/RadixArk/Kimi-K3-DSpark",
  "weights": "https://huggingface.co/RadixArk/Kimi-K3-DSpark",
  "architecture": {
    "type": "undisclosed",
    "parameters": "undisclosed",
    "context_window": "undisclosed",
    "quantization": "undisclosed (HF weights; not an Ollama tag)",
    "modalities_in": [
      "text"
    ],
    "modalities_out": [
      "text"
    ]
  },
  "training": {
    "knowledge_cutoff": "undisclosed",
    "methodology": "undisclosed (draft from Hugging Face Hub listing)",
    "tokens": "undisclosed"
  },
  "capabilities": {
    "natural_language": "full",
    "reasoning_math": "medium",
    "coding": "medium",
    "vision_input": "disabled",
    "audio_input": "disabled",
    "tool_use": "none",
    "notes": "Draft from HF Hub (2,645,687 downloads). Review before marking curated."
  },
  "safety": {
    "refusal_sensitivity": "medium",
    "instruction_following": "medium",
    "filter_type": "hybrid"
  },
  "generated": {
    "date": "2026-09-10",
    "generator": "directory refresh — Hugging Face Hub draft"
  },
  "credits": {
    "generated_with": "https://modelfacts.dev",
    "built_by": "Catalyst Forge — https://www.catalystforge.com/"
  }
}
