{
  "model_facts_version": "0.1.0",
  "status": "active",
  "name": "Grok 4.5",
  "developer": "xAI",
  "license": "Proprietary (API)",
  "homepage": "https://x.ai/",
  "architecture": {
    "type": "undisclosed (transformer-family)",
    "parameters": "undisclosed",
    "context_window": "500k",
    "quantization": "undisclosed",
    "modalities_in": [
      "text",
      "image"
    ],
    "modalities_out": [
      "text"
    ]
  },
  "training": {
    "knowledge_cutoff": "undisclosed",
    "methodology": "undisclosed",
    "tokens": "undisclosed"
  },
  "capabilities": {
    "natural_language": "full",
    "reasoning_math": "high",
    "coding": "high",
    "vision_input": "enabled",
    "audio_input": "disabled",
    "tool_use": "native",
    "notes": "xAI cheap-flagship tier; real-time X data integration claimed"
  },
  "safety": {
    "refusal_sensitivity": "low",
    "instruction_following": "high",
    "filter_type": "hybrid"
  },
  "generated": {
    "date": "2026-08-07",
    "generator": "directory seed — Ollama/API refresh 2026-08"
  },
  "credits": {
    "generated_with": "https://modelfacts.dev",
    "built_by": "Catalyst Forge — https://www.catalystforge.com/"
  }
}
