{
  "model_facts_version": "0.1.0",
  "status": "active",
  "name": "Kimi-K2.6",
  "developer": "Moonshot AI",
  "license": "UNKNOWN",
  "homepage": "https://ollama.com/library/kimi-k2.6",
  "weights": "https://ollama.com/library/kimi-k2.6",
  "architecture": {
    "type": "undisclosed (native multimodal agentic)",
    "parameters": "undisclosed",
    "context_window": "undisclosed",
    "quantization": "cloud / Ollama",
    "modalities_in": [
      "text",
      "image"
    ],
    "modalities_out": [
      "text"
    ]
  },
  "training": {
    "knowledge_cutoff": "undisclosed",
    "methodology": "undisclosed (long-horizon coding / agent orchestration)",
    "tokens": "undisclosed"
  },
  "capabilities": {
    "natural_language": "full",
    "reasoning_math": "high",
    "coding": "high",
    "vision_input": "enabled",
    "audio_input": "disabled",
    "tool_use": "native"
  },
  "safety": {
    "refusal_sensitivity": "medium",
    "instruction_following": "high",
    "filter_type": "hybrid"
  },
  "generated": {
    "date": "2026-08-07",
    "generator": "directory seed — Ollama/API refresh 2026-08"
  },
  "credits": {
    "generated_with": "https://modelfacts.dev",
    "built_by": "Catalyst Forge — https://www.catalystforge.com/"
  }
}
