{
  "model_facts_version": "0.1.0",
  "name": "o3",
  "developer": "OpenAI",
  "status": "active",
  "license": "Proprietary (API)",
  "release_date": "2025-04-16",
  "homepage": "https://openai.com/index/introducing-o3-and-o4-mini/",
  "architecture": {
    "type": "undisclosed (reasoning model)",
    "parameters": "undisclosed",
    "context_window": "200k",
    "quantization": "undisclosed",
    "modalities_in": [
      "text",
      "image"
    ],
    "modalities_out": [
      "text"
    ]
  },
  "training": {
    "knowledge_cutoff": "undisclosed",
    "methodology": "undisclosed (large-scale RL for reasoning)",
    "tokens": "undisclosed"
  },
  "capabilities": {
    "natural_language": "full",
    "reasoning_math": "high",
    "coding": "high",
    "vision_input": "enabled",
    "audio_input": "disabled",
    "tool_use": "native",
    "notes": "Deliberative reasoning model; latency/cost trade off for harder tasks"
  },
  "safety": {
    "refusal_sensitivity": "high",
    "instruction_following": "high",
    "filter_type": "censored"
  },
  "generated": {
    "date": "2026-08-03",
    "generator": "directory seed — human-reviewed judgment fields"
  },
  "credits": {
    "generated_with": "https://modelfacts.dev",
    "built_by": "Catalyst Forge — https://www.catalystforge.com/"
  }
}
