{
  "model_facts_version": "0.1.0",
  "status": "active",
  "name": "MiniMax-M3",
  "developer": "MiniMax",
  "license": "UNKNOWN",
  "homepage": "https://ollama.com/library/minimax-m3",
  "weights": "https://ollama.com/library/minimax-m3",
  "architecture": {
    "type": "undisclosed (native multimodal)",
    "parameters": "undisclosed",
    "context_window": "1M",
    "quantization": "cloud / Ollama",
    "modalities_in": [
      "text",
      "image"
    ],
    "modalities_out": [
      "text"
    ]
  },
  "training": {
    "knowledge_cutoff": "undisclosed",
    "methodology": "undisclosed (coding & agentic frontier)",
    "tokens": "undisclosed"
  },
  "capabilities": {
    "natural_language": "full",
    "reasoning_math": "high",
    "coding": "high",
    "vision_input": "enabled",
    "audio_input": "disabled",
    "tool_use": "native",
    "notes": "1M context; native multimodality per Ollama listing"
  },
  "safety": {
    "refusal_sensitivity": "medium",
    "instruction_following": "high",
    "filter_type": "hybrid"
  },
  "generated": {
    "date": "2026-08-07",
    "generator": "directory seed — Ollama/API refresh 2026-08"
  },
  "credits": {
    "generated_with": "https://modelfacts.dev",
    "built_by": "Catalyst Forge — https://www.catalystforge.com/"
  }
}
