{
  "model_facts_version": "0.1.0",
  "name": "ornith-1.5",
  "developer": "ornith",
  "status": "active",
  "license": "UNKNOWN",
  "homepage": "https://ollama.com/library/ornith-1.5",
  "weights": "https://ollama.com/library/ornith-1.5",
  "architecture": {
    "type": "undisclosed",
    "parameters": "397B",
    "context_window": "undisclosed",
    "quantization": "GGUF (Ollama default)",
    "modalities_in": [
      "text",
      "image"
    ],
    "modalities_out": [
      "text"
    ]
  },
  "training": {
    "knowledge_cutoff": "undisclosed",
    "methodology": "undisclosed (draft from Ollama library listing)",
    "tokens": "undisclosed"
  },
  "capabilities": {
    "natural_language": "full",
    "reasoning_math": "medium",
    "coding": "medium",
    "vision_input": "enabled",
    "audio_input": "disabled",
    "tool_use": "none",
    "notes": "Draft. Chirp Chirp! 🐦 We are introducing Ornith-1.5, a major step toward building foundation models through end-to-end self-improvement."
  },
  "safety": {
    "refusal_sensitivity": "medium",
    "instruction_following": "medium",
    "filter_type": "hybrid"
  },
  "generated": {
    "date": "2026-09-01",
    "generator": "directory refresh — Ollama listing draft"
  },
  "credits": {
    "generated_with": "https://modelfacts.dev",
    "built_by": "Catalyst Forge — https://www.catalystforge.com/"
  }
}
