{
  "model_facts_version": "0.1.0",
  "name": "Gemini 2.5 Flash",
  "developer": "Google DeepMind",
  "status": "active",
  "license": "Proprietary (API)",
  "release_date": "2025-04-17",
  "homepage": "https://deepmind.google/models/gemini/flash/",
  "architecture": {
    "type": "undisclosed (transformer-family)",
    "parameters": "undisclosed",
    "context_window": "1M",
    "quantization": "undisclosed",
    "modalities_in": [
      "text",
      "image",
      "audio",
      "video"
    ],
    "modalities_out": [
      "text"
    ]
  },
  "training": {
    "knowledge_cutoff": "undisclosed",
    "methodology": "undisclosed",
    "tokens": "undisclosed"
  },
  "capabilities": {
    "natural_language": "full",
    "reasoning_math": "high",
    "coding": "high",
    "vision_input": "enabled",
    "audio_input": "enabled",
    "tool_use": "native",
    "notes": "Latency/cost-oriented Flash tier with thinking option"
  },
  "safety": {
    "refusal_sensitivity": "high",
    "instruction_following": "high",
    "filter_type": "censored"
  },
  "generated": {
    "date": "2026-08-03",
    "generator": "directory seed — human-reviewed judgment fields"
  },
  "credits": {
    "generated_with": "https://modelfacts.dev",
    "built_by": "Catalyst Forge — https://www.catalystforge.com/"
  }
}
