{
  "model_facts_version": "0.1.0",
  "name": "DeepSeek-R1",
  "developer": "DeepSeek",
  "status": "active",
  "license": "MIT",
  "release_date": "2025-01-20",
  "weights": "https://huggingface.co/deepseek-ai/DeepSeek-R1",
  "architecture": {
    "type": "mixture of experts (MoE)",
    "parameters": "671B",
    "context_window": "128k",
    "quantization": "bf16",
    "modalities_in": [
      "text"
    ],
    "modalities_out": [
      "text"
    ],
    "active_parameters": "37B"
  },
  "training": {
    "knowledge_cutoff": "undisclosed",
    "methodology": "DeepSeek-V3 base → large-scale RL for reasoning (R1)",
    "tokens": "undisclosed"
  },
  "capabilities": {
    "natural_language": "full",
    "reasoning_math": "high",
    "coding": "high",
    "vision_input": "disabled",
    "audio_input": "disabled",
    "tool_use": "native",
    "notes": "Reasoning-first model; long chain-of-thought by default"
  },
  "safety": {
    "refusal_sensitivity": "low",
    "instruction_following": "high",
    "filter_type": "raw"
  },
  "generated": {
    "date": "2026-08-03",
    "generator": "directory seed — human-reviewed judgment fields"
  },
  "credits": {
    "generated_with": "https://modelfacts.dev",
    "built_by": "Catalyst Forge — https://www.catalystforge.com/"
  }
}
